{
  "artifact_id": "V0_OSAP_GATE3_CLUSTER_B_WP6_POST_MERGE_SYNC_FIXTURE",
  "development_ahead": 0,
  "expected_action": "NOOP",
  "expected_allowed": true,
  "expected_decision": "ALREADY_SYNCHRONIZED",
  "expected_diagnostic": "NONE",
  "fixture_id": "00_identical_0_0",
  "main_ahead": 0,
  "version": "0.1"
}
